{
  "schema": "db.component.digital",
  "version": 1,
  "part": "74HC21",
  "metadata": {
    "title": "Dual 4-Input AND Gate",
    "family": "74HC",
    "group": "74xx",
    "role": "and_gate"
  },
  "package": {
    "kind": "DIP",
    "pins": 14,
    "default": "N"
  },
  "pins": [
    {
      "number": 1,
      "name": "1A",
      "direction": "input"
    },
    {
      "number": 2,
      "name": "1B",
      "direction": "input"
    },
    {
      "number": 3,
      "name": "NC",
      "direction": "nc"
    },
    {
      "number": 4,
      "name": "1C",
      "direction": "input"
    },
    {
      "number": 5,
      "name": "1D",
      "direction": "input"
    },
    {
      "number": 6,
      "name": "1Y",
      "direction": "output"
    },
    {
      "number": 7,
      "name": "GND",
      "direction": "power",
      "rail": "GND"
    },
    {
      "number": 8,
      "name": "2Y",
      "direction": "output"
    },
    {
      "number": 9,
      "name": "2A",
      "direction": "input"
    },
    {
      "number": 10,
      "name": "2B",
      "direction": "input"
    },
    {
      "number": 11,
      "name": "NC",
      "direction": "nc"
    },
    {
      "number": 12,
      "name": "2C",
      "direction": "input"
    },
    {
      "number": 13,
      "name": "2D",
      "direction": "input"
    },
    {
      "number": 14,
      "name": "VCC",
      "direction": "power",
      "rail": "VCC"
    }
  ],
  "logic": {
    "type": "dual_4_input_and",
    "description": "Dual 4-Input AND Gate"
  },
  "timing": {
    "delay_ns": 15
  },
  "generation": {
    "targets": [
      "json",
      "python_simulator",
      "verilog_wrapper",
      "verilog_testbench",
      "kicad_symbol",
      "svg_pinout",
      "documentation",
      "unit_test",
      "interactive_demo"
    ],
    "python": {
      "factory": "create",
      "part": "74HC21",
      "file": "DB/74xx/74HC21/simulation/model.py",
      "class": "HC21"
    },
    "verilog": {
      "module": "ttl_74hc21",
      "file": "DB/74xx/74HC21/simulation/model.v",
      "netlist": "DB/74xx/74HC21/simulation/netlist.json"
    }
  },
  "verification": {
    "tests": [
      "truth_table",
      "timing",
      "propagation"
    ],
    "required_vectors": [
      "basic_function"
    ]
  },
  "datasheet": {
    "schema": "db.component.datasheet.sources",
    "version": 1,
    "part": "74HC21",
    "sources": [
      {
        "label": "Texas Instruments SN74HC21",
        "url": "https://www.ti.com/lit/ds/symlink/sn74hc21.pdf",
        "package_evidence": "N, 14-pin PDIP",
        "used_for": [
          "pins",
          "package",
          "logic"
        ]
      }
    ]
  },
  "definition_layers": {
    "component": {
      "schema": "db.component.definition",
      "version": 1,
      "part": "74HC21",
      "title": "Dual 4-Input AND Gate",
      "family": "74HC",
      "group": "74xx",
      "kind": "ic",
      "role": "and_gate"
    },
    "package": {
      "schema": "db.component.package",
      "version": 1,
      "part": "74HC21",
      "packages": [
        {
          "id": "N",
          "kind": "DIP",
          "pins": 14
        }
      ],
      "default_package": "N"
    },
    "pins": {
      "schema": "db.component.pins",
      "version": 1,
      "part": "74HC21",
      "pins": [
        {
          "number": 1,
          "name": "1A",
          "direction": "input"
        },
        {
          "number": 2,
          "name": "1B",
          "direction": "input"
        },
        {
          "number": 3,
          "name": "NC",
          "direction": "nc"
        },
        {
          "number": 4,
          "name": "1C",
          "direction": "input"
        },
        {
          "number": 5,
          "name": "1D",
          "direction": "input"
        },
        {
          "number": 6,
          "name": "1Y",
          "direction": "output"
        },
        {
          "number": 7,
          "name": "GND",
          "direction": "power",
          "rail": "GND"
        },
        {
          "number": 8,
          "name": "2Y",
          "direction": "output"
        },
        {
          "number": 9,
          "name": "2A",
          "direction": "input"
        },
        {
          "number": 10,
          "name": "2B",
          "direction": "input"
        },
        {
          "number": 11,
          "name": "NC",
          "direction": "nc"
        },
        {
          "number": 12,
          "name": "2C",
          "direction": "input"
        },
        {
          "number": 13,
          "name": "2D",
          "direction": "input"
        },
        {
          "number": 14,
          "name": "VCC",
          "direction": "power",
          "rail": "VCC"
        }
      ]
    },
    "power": {
      "schema": "db.component.power",
      "version": 1,
      "part": "74HC21",
      "rails": [
        {
          "number": 7,
          "name": "GND",
          "direction": "power",
          "rail": "GND"
        },
        {
          "number": 14,
          "name": "VCC",
          "direction": "power",
          "rail": "VCC"
        }
      ]
    },
    "logic": {
      "schema": "db.component.logic",
      "version": 1,
      "part": "74HC21",
      "logic": {
        "type": "dual_4_input_and",
        "description": "Dual 4-Input AND Gate"
      }
    },
    "timing": {
      "schema": "db.component.timing",
      "version": 1,
      "part": "74HC21",
      "delay": {
        "model_delay_ns": 15,
        "status": "datasheet-backed",
        "datasheet_typical_ns": {
          "4.5": 14
        },
        "datasheet_max_ns_25c": {
          "4.5": 22
        },
        "datasheet_max_ns_minus40_to_85c": {
          "4.5": 28
        },
        "conditions": {
          "load_pf": 50,
          "path": "A_B_C_D_to_Y",
          "section": "6.6 Switching Characteristics - 74"
        }
      },
      "evidence": {
        "label": "Texas Instruments SN74HC21",
        "url": "https://www.ti.com/lit/ds/symlink/sn74hc21.pdf",
        "package_evidence": "N, 14-pin PDIP",
        "used_for": [
          "pins",
          "package",
          "logic",
          "timing",
          "electrical"
        ]
      }
    },
    "electrical": {
      "schema": "db.component.electrical",
      "version": 1,
      "part": "74HC21",
      "recommended_operating": {
        "vcc_v": {
          "min": 2,
          "nom": 5,
          "max": 6
        },
        "input_voltage_v": {
          "min": 0,
          "max": "VCC"
        },
        "output_voltage_v": {
          "min": 0,
          "max": "VCC"
        },
        "vih_min_v": {
          "2.0": 1.5,
          "4.5": 3.15,
          "6.0": 4.2
        },
        "vil_max_v": {
          "2.0": 0.5,
          "4.5": 1.35,
          "6.0": 1.8
        },
        "input_transition_max_ns": {
          "2.0": 1000,
          "4.5": 500,
          "6.0": 400
        },
        "ta_c": {
          "min": -40,
          "max": 85
        }
      },
      "static_characteristics": {
        "input_leakage_max_ua": {
          "6.0": 1
        },
        "icc_max_ua": {
          "6.0": 20
        },
        "ci_max_pf": {
          "2.0_to_6.0": 10
        }
      },
      "loading": {
        "switching_test_load_pf": 50,
        "application_capacitive_load_limit_pf": 50
      },
      "evidence": {
        "label": "Texas Instruments SN74HC21",
        "url": "https://www.ti.com/lit/ds/symlink/sn74hc21.pdf",
        "package_evidence": "N, 14-pin PDIP",
        "used_for": [
          "pins",
          "package",
          "logic",
          "timing",
          "electrical"
        ]
      }
    }
  },
  "status": {
    "datasheet": "verified",
    "pinout": "verified",
    "python_behavior": "modeled",
    "verilog_model": "modeled",
    "verilog_export": "tested",
    "tests": "tested"
  }
}
